[
  {
    "platformId": "codex-cli",
    "target": "codex/AGENTS.md",
    "managed": true,
    "evidenceId": "plans/platforms/codex-cli.md",
    "id": "codex-cli-default"
  },
  {
    "platformId": "opencode",
    "target": ".opencode/AGENTS.md",
    "managed": true,
    "evidenceId": "plans/platforms/opencode.md",
    "id": "opencode-default"
  }
]
